{
    "author_id": "admin_user",
    "change_intent": {
        "proposed_modification": "Triage-only draft. See linked signals for details. NEXT: human review to author patch.",
        "rationale": "Pilot triage from 1 signals: Pilot run 20260208_211002 completed successfully"
    },
    "created_at_utc": "2026-02-09T15:01:00Z",
    "governance_id": "d68e5a92-3a47-4cbb-858e-c288936303af",
    "governance_state": "DRAFT",
    "linked_signal_ids": [
        "f5ab2eb6-5afe-4a2a-9010-e52fc7c5b969"
    ],
    "risk_level": "LOW",
    "schema_version": "1.0.0",
    "target_component": {
        "path": "orchestrator/config/run_config.json",
        "version_constraint": ">=0.5.2"
    }
}